DocText,DocDate,clean_content,emotions
400 private jets too the climate change summit amazing,2021-11-02 23:23:58,private jets climate change summit amazing,neutral
“Covid” restrictions are so much like “Climate Change” restrictions.. WEIRD HUH…,2021-11-02 23:22:22,Covid restrictions much like Climate Change restrictions WEIRD,neutral
"Thank you to everybody who made this a successful #bookbirthday for #AHotMess. I always said five books was when I'd feel like a true author, and thank you to all who helped me hit that goal. #amwriting #newbook #climatechange",2021-11-02 23:09:11,Thank everybody made this successful bookbirthday AHotMess always said five books when feel like true author thank helped that goal amwriting newbook climatechange,love
anti-climate change **** deserve love and respect,2021-11-02 22:27:22,anti climate change deserve love respect,love
Very alarming ang effects ng climate change especially sa third world countries.,2021-11-02 22:26:23,Very alarming effects climate change especially third world countries,neutral
"#tonightvmtv the 1% looney left are an amazing bunch, first ""experts"" on economics, then ""experts"" on virology and now ""experts"" on climate change",2021-11-02 22:16:05,tonightvmtv looney left amazing bunch first experts economics then experts virology experts climate change,neutral
So.. Morrison goes to Climate Change Forum with:  A pamphlet; an entourage; speaks to an empty room; insults the French and American Presidents; leaks communiqués; leaves Australian without any submarine contracts; makes best friends with dictators and more…good one,2021-11-02 22:02:33,Morrison goes Climate Change Forum with pamphlet entourage speaks empty room insults French American Presidents leaks communiqués leaves Australian without submarine contracts makes best friends with dictators more good,love
"If all the pro-vaccine mandate people love mandates so much, what will their response be when the government wants to mandate sterilization to help keep us safe from climate change?  IT'S FOR THE GOOD OF OTHER PEOPLE.",2021-11-02 21:48:38,vaccine mandate people love mandates much what will their response when government wants mandate sterilization help keep safe from climate change GOOD OTHER PEOPLE,love
Climate change... incredible 10yrs on and still Doing a great job of stopping this government focusing and fixing other broken things that need attention within this country,2021-11-02 21:36:12,Climate change incredible 10yrs still Doing great stopping this government focusing fixing other broken things that need attention within this country,worry
What is the main goal towards climate change? To be the best green country/city or find the best green solution for this Planet? Is being best in class the main goal???? #ClimateAction #ClimateEmergency @jonasgahrstore,2021-11-02 21:25:19,What main goal towards climate change best green country city find best green solution this Planet being best class main goal ClimateAction ClimateEmergency jonasgahrstore,happiness
RIP Geert. Thank you for all your contributions to climate change science. @gjvoldenborgh,2021-11-02 21:03:15,Geert Thank your contributions climate change science gjvoldenborgh,happiness
"Trevi fountain coin toss for good luck with climate change/Elijah Wood sorry for racist NFT exchange/Well, there it is again, that funny feeling",2021-11-02 20:38:55,Trevi fountain coin toss good luck with climate change Elijah Wood sorry racist exchange Well there again that funny feeling,worry
"#Tonight @ITV Doing a Boris Propaganda job on #ClimateChange Just popping into your head the expectation for ANOTHER Tory Tax, this time on our gas boilers. More expensive heating. More cost for taxpayers. For people like you &amp; me. *Reminder UK Global emissions of CO2 = 1%",2021-11-02 20:19:27,Tonight Doing Boris Propaganda ClimateChange Just popping into your head expectation ANOTHER Tory this time boilers More expensive heating More cost taxpayers people like Reminder Global emissions,worry
"Search ""uninhabitable hell"" on Twitter &amp; enjoy the unhinged shrieks of the delusional climate change zombie cult. Thank me later. 🤡🤣🤣",2021-11-02 20:07:31,Search uninhabitable hell Twitter enjoy unhinged shrieks delusional climate change zombie cult Thank later,happiness
"On this election day let's reflect how much better off we are as a Nation compared to a year ago. We are addressing Climate change, over 100 countries are on board. Thanks Joe, you're truly a great leader!",2021-11-02 20:04:38,this election reflect much better Nation compared year addressing Climate change over countries board Thanks truly great leader,happiness
Anyone else feel like climate change has been rammed down their throat on television this evening?,2021-11-02 19:58:54,Anyone else feel like climate change been rammed down their throat television this evening,worry
Canadian news is doing a better job covering the affects of climate change than the US.,2021-11-02 19:41:16,Canadian news doing better covering affects climate change than,neutral
Really enjoying the @NIH Climate Change &amp; Health Webinar Series and @PennMedicine's @Eugenia_South amazing presentation “Climate Resilience and Health Equity in Black Neighborhoods: The Case for Urban Nature.” Happy I can tune in! #urbanhealth,2021-11-02 19:27:30,Really enjoying Climate Change Health Webinar Series PennMedicine Eugenia_South amazing presentation Climate Resilience Health Equity Black Neighborhoods Case Urban Nature Happy tune urbanhealth,surprise
Incredible that the African and South American nations Namibia and Guyana are clearly leading the way with climate change where as the richest democracies do absolutely naff all. #COP26,2021-11-02 19:18:37,Incredible that African South American nations Namibia Guyana clearly leading with climate change where richest democracies absolutely naff COP26,neutral
Climate change is so real Crock Odumbass and many others keep buying ocean front mansions or getaways.... Lol,2021-11-02 19:17:52,Climate change real Crock Odumbass many others keep buying ocean front mansions getaways,neutral
Good that #C4News recognises that the rainforest's best defenders are those that live there and depend on it for their survival #COP26 #climatechange,2021-11-02 19:14:47,Good that C4News recognises that rainforest best defenders those that live there depend their survival COP26 climatechange,happiness
The most powerful governments are best at keeping  the ships running and the lights on.   To execute a 30 year plan and keep the planet alive we need the personal realization that climate action is nothing more than a matter of self preservation.   Change my mind.,2021-11-02 19:12:49,most powerful governments best keeping ships running lights execute year plan keep planet alive need personal realization that climate action nothing more than matter self preservation Change mind,love
"I find it absolutely hilarious that a teenager,@GretaThunberg drives so many “big” people crazy with her climate change stance. It’s crazy hilarious.",2021-11-02 19:09:54,find absolutely hilarious that teenager GretaThunberg drives many people crazy with climate change stance crazy hilarious,love
I keep having dreams about climate change.,2021-11-02 17:15:10,keep having dreams about climate change,neutral
400 Private jets for a meet about climate change. Fantastic.,2021-11-02 17:13:48,Private jets meet about climate change Fantastic,other
Alls I can say is; THANK **** FOR FOOTBALL. Especially with all this climate change **** #tippingpoint,2021-11-02 16:44:51,Alls THANK FOOTBALL Especially with this climate change tippingpoint,happiness
I see the Iona's Mr. Quinn is now a world class scientist. Well he seems to think so anyway with his posts about climate change.,2021-11-02 15:34:43,Iona Quinn world class scientist Well seems think anyway with posts about climate change,sadness
Who the **** is Great Thunberg and why the **** is someone who is shorter than 5 feet have such a big platform on climate change. Like the **** my climate is totally different than yours. 6-foot gang chillin only change we need is taller tree branches and more leg room on planes.,2021-11-02 15:34:29,Great Thunberg someone shorter than feet have such platform climate change Like climate totally different than yours foot gang chillin only change need taller tree branches more room planes,sadness
"Huge thank you, @vanessa_vash and Mary Robinson, for kicking off the “Mobilising the Rule of Law in Climate Change” #COP26 side event earlier today. @vanessa_vash drove home that we must keep fossil fuels in the ground, truly discuss loss and damage, and act now. #ClimateCrisis",2021-11-02 15:34:22,Huge thank vanessa_vash Mary Robinson kicking Mobilising Rule Climate Change COP26 side event earlier today vanessa_vash drove home that must keep fossil fuels ground truly discuss loss damage ClimateCrisis,sadness
"#Modi is giving wonderful bhashans about #environment protection, #climatechange in #Glasgow, meanwhile his party general secretary @CTRavi_BJP,  @KapilMishra_IND etc are saying we will burst more #firecrackers,we will create more #AirPollution 😌😌   #climate #COP26 #india",2021-11-02 15:33:56,Modi giving wonderful bhashans about environment protection climatechange Glasgow meanwhile party general secretary CTRavi_BJP KapilMishra_IND saying will burst more firecrackers will create more AirPollution climate COP26 india,worry
"Amazing talks so far in the ""Transgression and other climate change-driven shifts in coastal landscapes."" #CERF2021",2021-11-02 14:48:19,Amazing talks Transgression other climate change driven shifts coastal landscapes CERF2021,love
"Our director, @ScottSegerstrom, is speaking w/@TheEconomist tomorrow on #ColoradoClimateCorps, conservation corps, and climate change. Funded by @ServeColorado + @AmeriCorps, this program will transform Colorado's lives and landscapes. Thank YOU to the partners who engage corps!",2021-11-02 14:44:20,director ScottSegerstrom speaking TheEconomist tomorrow ColoradoClimateCorps conservation corps climate change Funded ServeColorado AmeriCorps this program will transform Colorado lives landscapes Thank partners engage corps,worry
"Stop blaiming ordinary people for climate change! Offer us realistic options for sustainable travel, reduce packaging, support sustainable energy providers, etc.  We’ll make good choices so the world is a good place for our kids as well!#COP26",2021-11-02 14:13:00,Stop blaiming ordinary people climate change Offer realistic options sustainable travel reduce packaging support sustainable energy providers make good choices world good place kids well COP26,worry
Great #climatesmart panel this am on #climatechange #climateadaptation organized by @toendhunger @FAOclimate @IFAD Thanks for your participation @CortevaUS @corteva,2021-11-02 13:58:16,Great climatesmart panel this climatechange climateadaptation organized toendhunger FAOclimate IFAD Thanks your participation CortevaUS corteva,happiness
Let's recap how Joe's trip to Europe is going? His accomplishments so far:  1. **** on himself in mtg with Pope. 2. Fell asleep during Climate Change Summit.   So much for Climate Change being an existential threat to our planet.  #PoopyPantsBiden  #LetsGoBrandon  #JoeBiden,2021-11-02 13:50:33,recap trip Europe going accomplishments himself with Pope Fell asleep during Climate Change Summit much Climate Change being existential threat planet PoopyPantsBiden LetsGoBrandon JoeBiden,worry
"Fantastic visit to @Techniquest this morning, great to see the new exhibits and discuss some ideas for climate change and green skills projects. Thanks @KirkpatrickLes1",2021-11-02 12:58:00,Fantastic visit Techniquest this morning great exhibits discuss some ideas climate change green skills projects Thanks KirkpatrickLes1,neutral
"I pray to the spirits &amp; ask them to bless, guide &amp; protect all our brothers &amp; sisters who are fighting to protect &amp; heal our Mother Earth 🌎. Thank you all ❤️. #ClimateChange #COP26",2021-11-02 12:50:31,pray spirits them bless guide protect brothers sisters fighting protect heal Mother Earth Thank ClimateChange COP26,sadness
Definitely a drought. People can keep taking climate change as a joke. I honestly think that's what's going to take out humans.,2021-11-02 12:48:24,Definitely drought People keep taking climate change joke honestly think that what going take humans,worry
"A great start to this year’s fantastic #UKCPA21 conference. After such a comprehensive update on COVID treatments, next at 13:10 is the very much awaited session - the impact of climate change on clinical pharmacy by @TLyons00 @BednallRuth @UKCPA #UKCPA2021..staying tuned!!",2021-11-02 12:39:35,great start this year fantastic UKCPA21 conference After such comprehensive update COVID treatments next very much awaited session impact climate change clinical pharmacy TLyons00 BednallRuth UKCPA UKCPA2021 staying tuned,love
"This year’s United Nations summit is seen as crucial. Severe impacts of climate change, like extreme weather events, are worsening faster than expected as the world quickly warms toward the Paris Agreement's temperature targets",2021-11-02 11:52:25,This year United Nations summit seen crucial Severe impacts climate change like extreme weather events worsening faster than expected world quickly warms toward Paris Agreement temperature targets,love
🌿💮Environmentalist🌲 🌏climate change enthusiast🗻🏞🏜 🌄🌅🌋🏔🏝 intrigued by mother nature 🌏 The best engineering that has ever been created 💯,2021-11-02 11:20:09,Environmentalist climate change enthusiast intrigued mother nature best engineering that ever been created,surprise
PM’s commitment to a carbon neutral India by 2070 is as good as saying we will wipe out poverty by 2090 if all goes well…  #ClimateChange #ClimateCrisis #ClimateAction,2021-11-02 10:27:32,commitment carbon neutral India 2070 good saying will wipe poverty 2090 goes well ClimateChange ClimateCrisis ClimateAction,worry
"Climate Change Diplomacy has been good for Zimbabwe . Inside the  walkabouts, exchange of greetings &amp; hospitality gestures ,  requests are made for further engagement . Dialogue is superior and more productive than standoffs for everyone .",2021-11-02 10:25:56,Climate Change Diplomacy been good Zimbabwe Inside walkabouts exchange greetings hospitality gestures requests made further engagement Dialogue superior more productive than standoffs everyone,love
"SteamDrills -If there's one more acre of love in this world, it's because of the pioneers of the heart, thank you. #ClimateChange",2021-11-02 09:20:08,SteamDrills there more acre love this world because pioneers heart thank ClimateChange,love
Big influx of horny climate change people on the dating apps this week,2021-11-02 09:01:15,influx horny climate change people dating apps this week,neutral
"Has any Small Modular #Nuclear Reactor #SMR been deployed so far, anywhere around the world?  Topics: #globalwarming #climatechange #carbonneutral  #decarbonization #COP26",2021-11-02 08:19:25,Small Modular Nuclear Reactor been deployed anywhere around world Topics globalwarming climatechange carbonneutral decarbonization COP26,happiness
"Where on #Twitter are the most effective solutions to #climatechange? That is, accounting for high intrinsic effectiveness of CO2 emission reduction as well as minimal systemic effects like rebound &amp; leakage. Relevant for #COP26 participants. Share your knowledge!",2021-11-02 08:15:37,Where Twitter most effective solutions climatechange That accounting high intrinsic effectiveness emission reduction well minimal systemic effects like rebound leakage Relevant COP26 participants Share your knowledge,neutral
"This climate change plan,starting in 2030 sounds very much like my Gym plan. ‘I’ll start monday’.",2021-11-02 07:12:12,This climate change plan starting 2030 sounds very much like plan start monday,hate
"Mai is the best Caribbean leader i have seen so far. Powerful, articulate, brilliant and brave. She no fraid to take on no body. Big up mi G. Real general#codered#climatechange",2021-11-02 05:50:03,best Caribbean leader have seen Powerful articulate brilliant brave fraid take body Real general codered climatechange,happiness
The Panchamrit formula given by PM is excellent &amp; have much importance for countries like us. Agriculture &amp; Human health are most affected area by climate change &amp; environmental depletion. Clean environment &amp; sustainable ecosystem can lead us to prosperity.,2021-11-02 05:09:32,Panchamrit formula given excellent have much importance countries like Agriculture Human health most affected area climate change environmental depletion Clean environment sustainable ecosystem lead prosperity,neutral
".@SamsungSupport Thanks for going 100% renewable in the U.S., Europe, and China! Climate change is here, and we need more bold corporate actions like this. Keep it up!",2021-11-02 05:08:56,SamsungSupport Thanks going renewable Europe China Climate change here need more bold corporate actions like this Keep,worry
AQI: 50 Advisory:- Good day for outdoor activities  #ClimateChange #PlantATree #AirQuality #environment #Healthy #Future #Children,2021-11-02 04:00:25,Advisory Good outdoor activities ClimateChange PlantATree AirQuality environment Healthy Future Children,worry
Nuclear war is by far a greater threat than climate change.,2021-11-02 03:49:47,Nuclear greater threat than climate change,neutral
Bitches love climate change,2021-11-02 02:20:35,Bitches love climate change,love
"Climate change: Is Greta Thunberg right about UK carbon emissions?   Is she right?  Ask her programmers!  Greta is totally uneducated in climate sciences.  She is a puppet on a string for an unnamed world order group.  She is a good performer and now memorizes her scripts, mostly",2021-11-02 02:16:54,Climate change Greta Thunberg right about carbon emissions right programmers Greta totally uneducated climate sciences puppet string unnamed world order group good performer memorizes scripts mostly,worry
Thank you #MGBookChat for all the great book selections with a #climatechange focus. #sd36tl #sd36learn,2021-11-02 02:02:47,Thank MGBookChat great book selections with climatechange focus sd36tl sd36learn,happiness
"So **** for brains Joey B has pooped his pants, fallen asleep during the climate change summit and emitted tons of carbon gas with his huge overboard motorcade and calls himself Jill's husband while he has been in Europe..great job you clown 🤡 what next Joe",2021-11-02 01:26:53,brains Joey pooped pants fallen asleep during climate change summit emitted tons carbon with huge overboard motorcade calls himself Jill husband while been Europe great clown what next,neutral
"Excellent talk on climate change by Dr. Adam Rosenblatt @roseadam for the Jax Sierra Club, informative and engaging. Also an excellent question-answerer, treating all comers with respect and replying with substance. Hooray for your service to the world and good grace.",2021-11-02 01:02:06,Excellent talk climate change Adam Rosenblatt roseadam Sierra Club informative engaging Also excellent question answerer treating comers with respect replying with substance Hooray your service world good grace,happiness
"A world where we address climate change is a better world! It’s filled with people with great jobs, cities integrated with nature, pristine areas teeming with wildlife, clean air for our children to breathe, physical &amp; mental well-being! #climatevision #ClimateJustice",2021-11-02 00:55:42,world where address climate change better world filled with people with great jobs cities integrated with nature pristine areas teeming with wildlife clean children breathe physical mental well being climatevision ClimateJustice,neutral
"I love when people are like ""if the CLIMATE is CHANGING... then WHY is it COLDER!!!"" and im like...  dude  its called ""Climate change"" for a reason",2021-11-02 00:37:11,love when people like CLIMATE CHANGING then COLDER like dude called Climate change reason,neutral
How typical of Doris Johnson to pontificate about tackling climate change as an emergency whilst only last week lowering tax on air fares. Hypocrisy at it's excellent best.,2021-11-01 23:49:13,typical Doris Johnson pontificate about tackling climate change emergency whilst only last week lowering fares Hypocrisy excellent best,neutral
I’m very impressed on how PM Davis tackling climate change with the big dogs,2021-11-01 23:40:25,very impressed Davis tackling climate change with dogs,sadness
"So appreciating the climate change education from our local, trusted meteorologists! Thank you, @CecilyTynan !!",2021-11-01 22:24:58,appreciating climate change education from local trusted meteorologists Thank CecilyTynan,neutral
Is 'climate change' becoming weaponized?  Who will suffer the least? Those countries with great land masses? Densely populated islands like UK are in great peril. Boris/Charles et al are aware of it. So is Putin and Xi Jinping.,2021-11-01 22:05:30,climate change becoming weaponized will suffer least Those countries with great land masses Densely populated islands like great peril Boris Charles aware Putin Jinping,love
Capitalism drives climate change. We need revolution. We need communism. Capitalism is the great destroyer.,2021-11-01 21:54:09,Capitalism drives climate change need revolution need communism Capitalism great destroyer,worry
"How wonderful the #ClimateChange story crossovers @Hollyoaks  @itvcorrie  @emmerdale  @bbceastenders  important messages,",2021-11-01 21:50:43,wonderful ClimateChange story crossovers Hollyoaks itvcorrie emmerdale bbceastenders important messages,neutral
The Biden Administration gave a waiver to “Climate Change” so we can have a normal winter. Amazing how long the fake “Climate Crisis” has lasted. 😎#ClimateCrisis #COP26 #ClimateHypocrisy,2021-11-01 21:36:22,Biden Administration gave waiver Climate Change have normal winter Amazing long fake Climate Crisis lasted ClimateCrisis COP26 ClimateHypocrisy,surprise
"Justin Trudeau is arguably the best actor this world has ever seen. He just acts like he cares about climate change and Indigenous people, and people actually believe him.  Credit where it's due.",2021-11-01 21:27:30,Justin Trudeau arguably best actor this world ever seen just acts like cares about climate change Indigenous people people actually believe Credit where,love
"The media has let us down badly over the years on climate change, as it influences how people vote, and ultimately policy. But it is very heartening to see so much critical coverage across all the big broadcasters. A game changer🤞. Kudos @rtenews @BBCNews @Channel4News @SkyNews",2021-11-01 21:10:12,media down badly over years climate change influences people vote ultimately policy very heartening much critical coverage across broadcasters game changer Kudos rtenews BBCNews Channel4News SkyNews,sadness
Climate Change is so incredible.   It can selectively target and cripe one airline at a time. 🤔,2021-11-01 21:05:37,Climate Change incredible selectively target cripe airline time,sadness
"GOOD EVENING FRIENDS AROUND THE WORLD 🌎✨GENTLE RAMBLER PRESENTS: BENEATH the SURFACE Episode 27 interview with @TurboKitty Co chairwoman of Nevada Green Party discusses abortion, climate change and more ENJOY. Also SPECIAL GUEST APPEARANCE ON @Jaybefaunt Show Solidarity🎧📢🎙",2021-11-01 21:01:18,GOOD EVENING FRIENDS AROUND WORLD GENTLE RAMBLER PRESENTS BENEATH SURFACE Episode interview with TurboKitty chairwoman Nevada Green Party discusses abortion climate change more ENJOY Also SPECIAL GUEST APPEARANCE Jaybefaunt Show Solidarity,happiness
- Biden falling asleep - Peak mask theatre (many disposable masks too of course) - Everyone arriving via private jet/gas guzzling car - Archbishop of Canterbury making a bizarre  comparison between Nazis and climate change  #COP26's going well so far!,2021-11-01 20:41:22,Biden falling asleep Peak mask theatre many disposable masks course Everyone arriving private guzzling Archbishop Canterbury making bizarre comparison between Nazis climate change COP26 going well,neutral
"HMU for the best Academic service Final paper √PowerPoint Computer science √environmental issues Sociology, history √discussion posts Thesis √reflections √biology √Essays √ climate change √Case study √Homework √Online course  dm for assistance @EssayProWriter",2021-11-01 20:35:03,best Academic service Final paper PowerPoint Computer science environmental issues Sociology history discussion posts Thesis reflections biology Essays climate change Case study Homework Online course assistance EssayProWriter,hate
.@janschakowsky I'm a voter in Arlington Heights. Regenerative agriculture can reverse global warming with best practices in farming and ranching! Nature has the best solutions to climate change. Please incorporate regenerative principles into ALL new ag bills!,2021-11-01 20:26:07,janschakowsky voter Arlington Heights Regenerative agriculture reverse global warming with best practices farming ranching Nature best solutions climate change Please incorporate regenerative principles into bills,neutral
The single best way to fight climate change is to be vegan. Its really simple.  #climate #ClimateEmergency #COP26 #climatechange #GoVegan #Vegan,2021-11-01 20:20:27,single best fight climate change vegan really simple climate ClimateEmergency COP26 climatechange GoVegan Vegan,happiness
