DocText,DocDate,clean_content,emotions
2021 November. The great Rhetoric of Everything. Climate Change gallops across the stage like a run away Horse headed for the steep Cliff of Disaster.,2021-11-01 20:14:27,2021 November great Rhetoric Everything Climate Change gallops across stage like away Horse headed steep Cliff Disaster,neutral
"I really recommend people watch a wonderful series with @AdeAdepitan on the BBC, where he visited those already losing their homes, their food sources, entire islands etc, due to climate change. 1/2",2021-11-01 19:58:56,really recommend people watch wonderful series with AdeAdepitan where visited those already losing their homes their food sources entire islands climate change,worry
"In the @australian today: Powerful Morrison sinks Macron It was Biden's fault, all of it Morrison's stirring address on climate change Best Plan ever Gladys is great, scrap ICAC",2021-11-01 19:54:20,australian today Powerful Morrison sinks Macron Biden fault Morrison stirring address climate change Best Plan ever Gladys great scrap ICAC,happiness
Channel 4 news is streets ahead of any other news organisation.  The report tonight on climate change is  really well researched and informed. #ch4news,2021-11-01 19:47:35,Channel news streets ahead other news organisation report tonight climate change really well researched informed ch4news,sadness
"Climate change activism is like when the hobbits ask ents for help, only once the ents see the devastation they just keep meeting.  Oh, and the ents are in league with Saruman.",2021-11-01 19:21:07,Climate change activism like when hobbits ents help only once ents devastation they just keep meeting ents league with Saruman,other
"#COP26 #COP26Glasgow #Cop26ClimateAction ....saving the planet💯 enough of the burnings|pollution|hunger|drought|floods|climate change with so much unpredictability. Perfect, incredible coverage @ZeynWandati  you're one of the reliables on this global conference👏 @ntvkenya",2021-11-01 18:34:21,COP26 COP26Glasgow Cop26ClimateAction saving planet enough burnings pollution hunger drought floods climate change with much unpredictability Perfect incredible coverage ZeynWandati reliables this global conference ntvkenya,happiness
given that one day of Allah is worth 1000 years of those which you count. So one year will definitely worth 360000 of those which you count. Imam Nasser Mohammed Al-Yamani 14-10-2021 102 #Torment_Planet_Has_Neared  COP26 climatechange Sleepy Joe Climate Emergency nAMVgx,2021-11-01 18:24:46,given that Allah worth 1000 years those which count year will definitely worth 360000 those which count Imam Nasser Mohammed Yamani 2021 Torment_Planet_Has_Neared COP26 climatechange Sleepy Climate Emergency nAMVgx,neutral
Work leaders really threw some coins into a wishing well and hoped for the best with climate change. I hate it all!,2021-11-01 18:18:30,Work leaders really threw some coins into wishing well hoped best with climate change hate,sadness
If climate change is real then why is the temperature today perfect and there are a perfect amount of clouds out?,2021-11-01 17:56:57,climate change real then temperature today perfect there perfect amount clouds,other
So far...haven't really seen anything new and ground breaking coming out of #COP26. Because we perpetuate the systems and axis of power that caused climate change in the first place.   Really think we need to consider #degrowth as radically as possible. It's tough..love.,2021-11-01 17:47:55,haven really seen anything ground breaking coming COP26 Because perpetuate systems axis power that caused climate change first place Really think need consider degrowth radically possible tough love,surprise
"Good grief, bore off with your climate change agenda🙄 #thechase",2021-11-01 17:45:58,Good grief bore with your climate change agenda thechase,neutral
".@Kohls Thank you for your commitment to carbon neutrality! Climate change is here, and we need bold corporate action like this. Keep up the good work!",2021-11-01 17:03:29,Kohls Thank your commitment carbon neutrality Climate change here need bold corporate action like this Keep good work,love
As these climate change worshippers convene let’s ask a simple question. How often have the scientists been wrong during Covid? Are we really going to wreck our economy over more unproven and likely politically motivated “science”?,2021-11-01 16:31:01,these climate change worshippers convene simple question often have scientists been wrong during Covid really going wreck economy over more unproven likely politically motivated science,sadness
"Climate change, Brexit, COVID, homelessness, food banks, NHS, Sewage dumping, child poverty, job security, wages, pensions, fuels poverty, OMG it’s all looking very very dodgy!!!",2021-11-01 16:11:47,Climate change Brexit COVID homelessness food banks Sewage dumping child poverty security wages pensions fuels poverty looking very very dodgy,worry
Replying to @YUGALJOSHI @HartleyKris @gdhoj @maheshwarigupt2 Many thanks for kind comments on our book #Water Security under #ClimateChange. Very much appreciated @CtortajadaQ @UofGSocSci #UofGCOP26 @WRDWaterMatters @TheWaterCentre,2021-11-01 16:08:26,Replying YUGALJOSHI HartleyKris gdhoj maheshwarigupt2 Many thanks kind comments book Water Security under ClimateChange Very much appreciated CtortajadaQ UofGSocSci UofGCOP26 WRDWaterMatters TheWaterCentre,fun
It’s great that the world leaders are discussing #climatechange so seriously. This way we can buy plastic accessories and single use costumes for #Halloween for many more years to come.  #HappyHalloween  #halloween2021 #COP26Glasgow,2021-11-01 16:06:45,great that world leaders discussing climatechange seriously This plastic accessories single costumes Halloween many more years come HappyHalloween halloween2021 COP26Glasgow,fun
I love that @CBCNews @RadioCanadaInfo has decided to cover ongoing climate change. Feels like a new commitment. @cathmckenna have you heard this before?,2021-11-01 16:01:13,love that CBCNews RadioCanadaInfo decided cover ongoing climate change Feels like commitment cathmckenna have heard this before,worry
Listening to some of the speeches coming out of the climate change conference this great reset stuff is getting very real very quickly,2021-11-01 15:16:48,Listening some speeches coming climate change conference this great reset stuff getting very real very quickly,happiness
Thank you @MichaelEMann for Zooming into my Global Climate Change class today for a wonderful Q&amp;A session. @SUNYSFLK,2021-11-01 15:14:38,Thank MichaelEMann Zooming into Global Climate Change class today wonderful session SUNYSFLK,happiness
Great big horses ****! Wind baw. #WindBaw  climate change politician bs gives off more gas than my aunt Fanny.,2021-11-01 14:57:01,Great horses Wind WindBaw climate change politician gives more than aunt Fanny,love
👀📺Keep an eye out on @ITVCentral 6-6.30pm today for our very own @wizpa commenting from #Glasgow #COP26 following her successful 280 mile #climate #cycle! 🚲  She's attending the #Conference as an #Observer all week too! 👓  #climatechange #lowcarbon,2021-11-01 14:54:29,Keep ITVCentral 30pm today very wizpa commenting from Glasgow COP26 following successful mile climate cycle attending Conference Observer week climatechange lowcarbon,other
"Riding your bike in North Dakota, instead of motoring around polluting the air, will greatly reduce pollutants in the air, Climate change is real, so let's do something about it, this tweet would like to thank our proud supporter, EcoOps",2021-11-01 14:43:37,Riding your bike North Dakota instead motoring around polluting will greatly reduce pollutants Climate change real something about this tweet would like thank proud supporter EcoOps,happiness
"LIVE NOW || Michelle Kalamandeen @Cambridge_Uni discusses the challenges various communities face worldwide such as managing land and agriculture, as well as dealing directly with climate change.  #ThePowerOfPlace #ClimateChange #COP26",2021-11-01 14:40:38,LIVE Michelle Kalamandeen Cambridge_Uni discusses challenges various communities face worldwide such managing land agriculture well dealing directly with climate change ThePowerOfPlace ClimateChange COP26,other
"Anyone considered FART, and its impact on climate change? #COP26",2021-11-01 14:39:51,Anyone considered FART impact climate change COP26,neutral
What govt is really doing for #climatechange ? Other than using taxpayers money ? . #ban firecrackers 🧨. #antinatalism #efilism,2021-11-01 14:20:19,What govt really doing climatechange Other than using taxpayers money firecrackers antinatalism efilism,surprise
World leaders really tossed a good luck coin to fight climate change? How is my writing supposed to top this?,2021-11-01 14:06:55,World leaders really tossed good luck coin fight climate change writing supposed this,worry
Anyone else feel like this climate change stuff is a load of nonsense?,2021-11-01 13:53:21,Anyone else feel like this climate change stuff load nonsense,sadness
This gentleman has been observing #climatechange for 35 years.  I highly recommend you check out his Twitter account  @EcoSenseNow and learn about our #ClimateEmergency,2021-11-01 13:46:53,This gentleman been observing climatechange years highly recommend check Twitter account EcoSenseNow learn about ClimateEmergency,surprise
"First stop on Nanook's #BookTour during .@COP26 with @LoveBooksGroup 🐾🌍  ""This little book was great to open up a conversation with my 8 year old about climate change. She liked Nanook's character alot... Overall a good informative read 😀"" - Melissa, Craft and Book Junkie NI",2021-11-01 13:41:07,First stop Nanook BookTour during COP26 with LoveBooksGroup This little book great open conversation with year about climate change liked Nanook character alot Overall good informative read Melissa Craft Book Junkie,happiness
"Sir David Attenborough has fucking nailed it. That's what you call environmental passion, warnings and a vision of hope over doom to tackle climate change. Amazing. #COP26",2021-11-01 13:18:35,David Attenborough fucking nailed That what call environmental passion warnings vision hope over doom tackle climate change Amazing COP26,neutral
"I think the city of Glasgow hosting #COP26 is truly amazing for the country of Scotland. I truly hope, it brings real change to the planet and helps fight the cause of climate change. I hope Glasgow can make amazing history during #COP26 #COP26Glasow #PeopleMakeGlasgow",2021-11-01 13:17:51,think city Glasgow hosting COP26 truly amazing country Scotland truly hope brings real change planet helps fight cause climate change hope Glasgow make amazing history during COP26 COP26Glasow PeopleMakeGlasgow,love
Starting a conversation about climate change is the best way to begin a journey of moving towards a green life.,2021-11-01 13:17:40,Starting conversation about climate change best begin journey moving towards green life,worry
"Love the subtle periphrasis of @RndmForestRunnr at COP26...  'To give anything less than our best...'  A very different context, equally relevant to climate change as it is to running #COP26",2021-11-01 13:02:25,Love subtle periphrasis RndmForestRunnr COP26 give anything less than best very different context equally relevant climate change running COP26,love
Like the climate cares how much Tory on #politicslive spins UK record on #climatechange.,2021-11-01 12:32:31,Like climate cares much Tory politicslive spins record climatechange,worry
Anyone else wander what the carbon emmissions totals are for 25k people descending on Glasgow? #climatechange,2021-11-01 12:25:54,Anyone else wander what carbon emmissions totals people descending Glasgow climatechange,worry
"Amazing how so many of the same folk are experts on virology, gender equality, male violence, mental health and now to top it all off... Climate change too! Amazing. More power to them. Heros walk among us.",2021-11-01 12:18:04,Amazing many same folk experts virology gender equality male violence mental health Climate change Amazing More power them Heros walk among,surprise
"🚨🔥🚨𝗕𝗥𝗘𝗔𝗞𝗜𝗡𝗚: PM greets world leaders at Glasgow summit for 'last, best hope' to tackle climate change: Global leaders are gathering in Glasgow for critical climate change talks, regarded as the world's ""last, best hope"" to avoid…     VIA @SkyNews - @BHheadlines©",2021-11-01 12:10:33,𝗕𝗥𝗘𝗔𝗞𝗜𝗡𝗚 greets world leaders Glasgow summit last best hope tackle climate change Global leaders gathering Glasgow critical climate change talks regarded world last best hope avoid SkyNews BHheadlines,love
".@Walmart Thank you for committing to slash 1 gigaton of emissions by 2030. That's huge! Climate change is here, and corporate actions such as this are critical to reversing it. Keep up the good work!",2021-11-01 12:03:22,Walmart Thank committing slash gigaton emissions 2030 That huge Climate change here corporate actions such this critical reversing Keep good work,happiness
It’s cold crisp and colorful Fall morning here in Erie.. thank you fake man made climate change!,2021-11-01 11:56:47,cold crisp colorful Fall morning here Erie thank fake made climate change,love
I'm very clear that Brazzers is important to climate change talks,2021-11-01 11:51:18,very clear that Brazzers important climate change talks,sadness
"Yellen today: ""I see carbon pricing as a very efficient way"" to deal with climate change. ""It has a lot recommend it""",2021-11-01 11:33:58,Yellen today carbon pricing very efficient deal with climate change recommend,worry
Well done to the pupils @ECABasingstoke - their incredible work with WWF and The Grange Festival for COP26 has been featured on both BBC South Today and BBC local radio #climatechange #futurevisions #yourvoice,2021-11-01 10:42:53,Well done pupils ECABasingstoke their incredible work with Grange Festival COP26 been featured both South Today local radio climatechange futurevisions yourvoice,happiness
"🌍#COP26 is well underway!  In the spirit of all things green, we’d like to ask you:  Are you interested in working in a green job that helps fight climate change?  #WeAreHays #GreenerFuture",2021-11-01 10:25:34,COP26 well underway spirit things green like interested working green that helps fight climate change WeAreHays GreenerFuture,worry
"#Nature has never featured as prominently in any @UNFCCC #COP than it will in Glasgow.  To keep up-to-date on nature-related events at #COP26 ,  I would highly recommend following: - @DefraGovUK  - @Nature4Climate  - @TNFD_  - @BfNCoalition  - @FinanceforBio  - @cisl_nature",2021-11-01 10:24:18,Nature never featured prominently UNFCCC than will Glasgow keep date nature related events COP26 would highly recommend following DefraGovUK Nature4Climate TNFD_ BfNCoalition FinanceforBio cisl_nature,worry
The Climate has changed wonderfully today.  Yesterday the Climate was rainy and today the Climate is really sunny!  I do like Climate Change.  #OCLIMATE,2021-11-01 10:05:04,Climate changed wonderfully today Yesterday Climate rainy today Climate really sunny like Climate Change OCLIMATE,sadness
Good morning and happy #COP26! What changes are you hoping to see from this year's conference? #sustainability #energysaving #climatechange,2021-11-01 09:50:22,Good morning happy COP26 What changes hoping from this year conference sustainability energysaving climatechange,happiness
"For communities across #Africa, the impacts of climate change are being felt right now.   As world leaders come together to step up #ClimateAction and ensure we keep 1.5° alive, here's why #COP26 is so important.",2021-11-01 09:00:30,communities across Africa impacts climate change being felt right world leaders come together step ClimateAction ensure keep alive here COP26 important,happiness
Good morning my cunning little climate change challengers xx,2021-11-01 08:11:52,Good morning cunning little climate change challengers,neutral
#G20: a great victory for Italy's image on the international scenario. A disappointment with regards to climate change.,2021-11-01 07:05:02,great victory Italy image international scenario disappointment with regards climate change,happiness
Love how all the media are like wow young Māori activist climate change etc etc etc … you didn’t pay attention to any of them when they were home 🤦🏾‍♀️🤦🏾‍♀️🤦🏾‍♀️ better keep this energy !!!!!,2021-11-01 05:21:09,Love media like young Māori activist climate change didn attention them when they were home better keep this energy,worry
I'm hearing good things about Race for Tomorrow by Simon Mundy. Looks like a great piece on how the climate crisis is impacting the modern world! Look forward to reading it soon   #sustainability #environment #climatechange #BookTwitter  #BooksWorthReading,2021-11-01 04:55:14,hearing good things about Race Tomorrow Simon Mundy Looks like great piece climate crisis impacting modern world Look forward reading soon sustainability environment climatechange BookTwitter BooksWorthReading,love
".@IKEAUSA Thank you for going carbon positive by 2030! Climate change is here, and we need bold corporate actions like this. Keep it up!",2021-11-01 02:35:29,IKEAUSA Thank going carbon positive 2030 Climate change here need bold corporate actions like this Keep,worry
I'm very clear that sweet jumps are important to climate change talks,2021-11-01 00:50:04,very clear that sweet jumps important climate change talks,surprise
Thank to G20 summit leaders unity in taking right decisions to uphold climate change and Corona virus challenges mitigation by wearing safety masks and Vaccination for all who opt for good health. Thank you Sir.,2021-11-01 00:41:42,Thank summit leaders unity taking right decisions uphold climate change Corona virus challenges mitigation wearing safety masks Vaccination good health Thank,love
Thank you climate change for making Halloween even sluttier this year!,2021-10-31 23:36:41,Thank climate change making Halloween even sluttier this year,love
"SteamDrills -Build paths for folks to follow, like a railroad toward their future ClimateChange Inspiration 5Star by RiveraSunAuthor",2021-10-31 21:41:09,SteamDrills Build paths folks follow like railroad toward their future ClimateChange Inspiration 5Star RiveraSunAuthor,neutral
Wonderful to see #PetePostlethwaite on that quintessential #Storyville #TheAgeOfStupid . *Our* age re Climate Change.,2021-10-31 21:30:30,Wonderful PetePostlethwaite that quintessential Storyville TheAgeOfStupid Climate Change,neutral
Fantastic forthright v clear interview with @CFigueres on @RNBreakfast just now. Calling out Australia's incredible irresponsibility re climate change &amp; @ScottMorrisonMP Gvt stupidity not maximising our 'treasure trove' of renewable riches. Just ahead of Macron in making my day!,2021-10-31 21:26:25,Fantastic forthright clear interview with CFigueres RNBreakfast just Calling Australia incredible irresponsibility climate change ScottMorrisonMP stupidity maximising treasure trove renewable riches Just ahead Macron making,surprise
"Brilliant ideas happening @somalisintech climate change hackathon, loved every presentation. Kudos to the teams 🙌",2021-10-31 20:50:17,Brilliant ideas happening somalisintech climate change hackathon loved every presentation Kudos teams,love
"Thank you @POTUS for your commitment to reducing CO2 50% by 2030. The impacts of climate change are upon us. The fastest, most effective tool? A #PriceOnCarbon coupled with a cashback dividend. #GemStCCL, @citizensclimate",2021-10-31 20:09:24,Thank POTUS your commitment reducing 2030 impacts climate change upon fastest most effective tool PriceOnCarbon coupled with cashback dividend GemStCCL citizensclimate,happiness
Dear Billionaires.  Thank you for spending more carbon than I will ever use in my entire life to lecture me on climate change.  Dually noted.,2021-10-31 19:07:38,Dear Billionaires Thank spending more carbon than will ever entire life lecture climate change Dually noted,worry
Imported legumes have drastically less impact on climate change than local beef.   This is because transport makes up a very small percentage of a foods GHG footprint.   Italian beans for example are a more environmentally choice for Australian’s than local beef.,2021-10-31 18:46:44,Imported legumes have drastically less impact climate change than local beef This because transport makes very small percentage foods footprint Italian beans example more environmentally choice Australian than local beef,sadness
"HAPPY HALLOWEEN FRIENDS 🎃 🎆 GENTLE RAMBLER PRESENTS Episode 27 Interview with @TurboKitty co chairwoman of Nev Green Party, Abortion, Climate Change and much more ENJOY 👍🎙️🌍 ALSO THANK YOU TO @Jaybefaunt for having me on his SHOW!! #FHL #podcasts",2021-10-31 18:41:50,HAPPY HALLOWEEN FRIENDS GENTLE RAMBLER PRESENTS Episode Interview with TurboKitty chairwoman Green Party Abortion Climate Change much more ENJOY ALSO THANK Jaybefaunt having SHOW podcasts,happiness
"It's 66 degrees here on Halloween. Like most New Englanders, I remember many a year having to wear a ski jacket and gloves under the costume. #ClimateChange",2021-10-31 18:40:12,degrees here Halloween Like most Englanders remember many year having wear jacket gloves under costume ClimateChange,neutral
"GREETINGS FRIENDS AROUND THE WORLD 🌍🌃☕ GENTLE RAMBLER PRESENTS: Beneath the Surface Episode 27 Interview with @TurboKitty on Abortion, Climate Change, Green Party and more ENJOY 🎙️👍💯",2021-10-31 18:19:32,GREETINGS FRIENDS AROUND WORLD GENTLE RAMBLER PRESENTS Beneath Surface Episode Interview with TurboKitty Abortion Climate Change Green Party more ENJOY,happiness
"I love that when @GretaThunberg arrives at #COP26 her “security” entourage is a swarm of women who surround her, locked in arms, moving her forward. Contrast that w/ leaders who’ve led less than her on key crises like climate change, armored and paranoid. True leadership, Greta.",2021-10-31 18:11:41,love that when GretaThunberg arrives COP26 security entourage swarm women surround locked arms moving forward Contrast that leaders less than crises like climate change armored paranoid True leadership Greta,love
Climate change - every little helps.  Enormous amounts of pork chop for dinner!,2021-10-31 17:45:59,Climate change every little helps Enormous amounts pork chop dinner,neutral
"Thinking about what my generation has contributed to mankind (so far), I think we're doing a decent job, leaving this place and it's inhabitants in a better state than we found it, you know until we all die due to climate change 💜",2021-10-31 17:09:09,Thinking about what generation contributed mankind think doing decent leaving this place inhabitants better state than found know until climate change,worry
HAPPY #Sustainable #SupplyChainSunday!   #SupplyChain is now recognized as more important than ever before in the fight against #ClimateChange!  #Follow   @SupplyChain  @SCM_Technology   @SupplyChainNtwk @DistLogistics   @JeffAshcroft! Cheers!  #SCM #ecommerce #fulfillment #COP26,2021-10-31 17:06:18,HAPPY Sustainable SupplyChainSunday SupplyChain recognized more important than ever before fight against ClimateChange Follow SupplyChain SCM_Technology SupplyChainNtwk DistLogistics JeffAshcroft Cheers ecommerce fulfillment COP26,love
Really interesting read and photos on how Glasgow has changed-good for both geographers and @BarrheadHistory   Glasgow: The last best hope to fight climate change,2021-10-31 16:39:36,Really interesting read photos Glasgow changed good both geographers BarrheadHistory Glasgow last best hope fight climate change,love
"Chuck has the audacity to lecture on Climate Change? Really? Wonder how much damage has been done by heating massive, empty palaces? Flying first class around the world? Slaughtering animals for fun? Hypocrite",2021-10-31 16:22:10,Chuck audacity lecture Climate Change Really Wonder much damage been done heating massive empty palaces Flying first class around world Slaughtering animals Hypocrite,worry
The best way to attack climate change to use as much clean energy as possible and then supplement with easily deployable coal for those unpredictable circumstances #ClimateAction #ClimateEmergency #Climate #COP26 #GlobalWarming #Pollution #CO2,2021-10-31 13:40:20,best attack climate change much clean energy possible then supplement with easily deployable coal those unpredictable circumstances ClimateAction ClimateEmergency Climate COP26 GlobalWarming Pollution,neutral
Love is Love All lives Matter Climate change is real All humans deserve rights Lgbtq+ is Valid,2021-10-31 13:16:38,Love Love lives Matter Climate change real humans deserve rights Lgbtq Valid,love
"To all my great great @ManUtd fans around this great American globe that want to visit Old Trafford in Scotland, vote for me and I will end the war on climate change, TODAY!!!! Making it simple to fly anywhere. #G20 #PremierLeague",2021-10-31 12:50:43,great great ManUtd fans around this great American globe that want visit Trafford Scotland vote will climate change TODAY Making simple anywhere PremierLeague,happiness
It’s a very dark and damp Fall morning here in Erie.. thank you fake man made climate change!,2021-10-31 12:09:22,very dark damp Fall morning here Erie thank fake made climate change,love
